{
  "$schema": "./schemas/limex-sfh-fuzzi-repo-capsule-receipt-v1.schema.json",
  "schema_version": "limex-sfh-fuzzi-repo-capsule-receipt-v1.0.0",
  "created_at_utc": "2026-09-16T04:05:35Z",
  "status": "PUBLIC_RELEASE_CANDIDATE__DOUBLE_BLIND_REAUDIT_PASS_WITH_DECLARED_LIMITS",
  "component": "components/sfh-fuzzi",
  "scope": "SOFTWARE_FUNCTIONAL_CORE_AND_REFERENCE_HOLD_RELEASE_ADAPTER_ONLY",
  "repo_integration": {
    "contract_sha256": "04ba823eb2657a21e0f893cb7dd539ebdcfe4e32f8212e5257d237d542710572",
    "target_repository": "https://github.com/tobias-sproete-ai/limex.git",
    "target_ref": "refs/heads/main",
    "target_component_path": "components/sfh-fuzzi",
    "status": "PUBLIC_RELEASE_AUTHORIZED__EXACT_TAG_AND_ASSET_READBACK_PENDING"
  },
  "successor_precheck": {
    "status": "PASS",
    "evidence_visibility": "PRIVATE_UPSTREAM_NOT_REPRODUCIBLE_FROM_PUBLIC_CAPSULE",
    "commands": 82,
    "native_checks": 2216,
    "candidate_full_tree_sha256": "8954a7a9697e538ee82918e8c73e4c393850e0ce426840a306b6b95c662be8a7",
    "candidate_runtime_identity": "LIMEX_TREE_SHA256_3898ff3fd3f78bf014f06058394f93ec7eaf27e0ee8ceb8868416e02ca751f26",
    "private_command_capture_sha256": "fc7ca1f74d441f6a3f5717ba35408c28a5df1fe6c67d53d7183d4ec9710d6582",
    "private_native_validator_report_sha256": "699278798d08213b1cc34b69c4cb0b8bad46bc5d6d33b3ee0277d7ea5d7e3d27"
  },
  "reference_runtime": {
    "platform": "darwin_arm64",
    "node_version": "v24.13.1",
    "node_executable_sha256": "29ecb10b64e8de28f5073f0b91f2fdc9ee60a0e21995edfcacb02eb0aae01a79",
    "network_boundary_attestation": "NOT_ATTESTED_BY_JAVASCRIPT_HARNESSES"
  },
  "software_stress_result": {
    "status": "PASS_SOFTWARE_FUNCTIONAL_CORE_ONLY",
    "runs": 18,
    "passed": 18,
    "failed": 0,
    "assertions": 81,
    "result_sha256": "bffde7edc3e5d28cebcfb9be8901d9b98584e93efb7b3a372b44c1147df431ec"
  },
  "hold_release_result": {
    "status": "PASS_REFERENCE_ADAPTER_ONLY",
    "runs": 31,
    "passed": 31,
    "failed": 0,
    "assertions": 195,
    "result_sha256": "d2a0afdcbd92297b350313fcb27fe7316d7d1d80e956ae8c63de24e60c21e5cb"
  },
  "independent_reaudit": {
    "status": "PASS_WITH_DECLARED_LIMITS__PRIVATE_UPSTREAM_REPORTS",
    "auditor_count": 2,
    "reports": [
      {
        "path": "PRIVATE_UPSTREAM/evidence/audits/SECURITY_DOUBLE_BLIND_FINAL_PASS_A.md",
        "sha256": "a7d312f3b896535f5b79fce6bd4e21253fd6c8f320331ef7a145fb37af8a0659"
      },
      {
        "path": "PRIVATE_UPSTREAM/evidence/audits/REPO_DOUBLE_BLIND_FINAL_PASS_B.md",
        "sha256": "e2ef422882d0e4876ae2e9ce7d4d59669808917c4e990d04a329a196794ea50f"
      }
    ]
  },
  "payload_hashes": [
    {
      "path": "GOLDSTANDARD_SFH_FUZZI_v1_0.md",
      "sha256": "b87e4fa8dd8aaaa4ba23bc092dbe9b16e8df76bb010de2006bcc88767fc5de8d"
    },
    {
      "path": "MARCUS_AND_TOBIAS.md",
      "sha256": "3bdcf1fc0e308bdbd1128164f79058d6d24e60af2ac4bd23eef5ce464f1151b0"
    },
    {
      "path": "NOTICE.md",
      "sha256": "bcff664557ea1f524d6fc03ec11db694895c4b19d9926853e07ba371ee9c79c9"
    },
    {
      "path": "README.en.md",
      "sha256": "1b713f75ee23b1997de51418d193c27c381e20598f54cb9bb2f8e70d86532d0d"
    },
    {
      "path": "README.md",
      "sha256": "e0056f53108f309558ac02ade0097f9297f296e1ebd17f9c2886144d6960c92c"
    },
    {
      "path": "REPO_INTEGRATION_CONTRACT.json",
      "sha256": "04ba823eb2657a21e0f893cb7dd539ebdcfe4e32f8212e5257d237d542710572"
    },
    {
      "path": "SCOPE_AND_NON_IMPLICATIONS.md",
      "sha256": "5633eb2703d40a8b1f0eb1d19703837790e54ca4daf0587c891f79c59a3f9175"
    },
    {
      "path": "package.json",
      "sha256": "97ed647e4d4df2362166d05b3f654cb47ed64a91422026124eb958d34dd02bba"
    },
    {
      "path": "receipts/RESULT_FUZZI_SFH_SOFTWARE_STRESS_v1_0.json",
      "sha256": "bffde7edc3e5d28cebcfb9be8901d9b98584e93efb7b3a372b44c1147df431ec"
    },
    {
      "path": "receipts/RESULT_GLOBAL_HOLD_RELEASE_ADVERSARIAL_v1_0.json",
      "sha256": "d2a0afdcbd92297b350313fcb27fe7316d7d1d80e956ae8c63de24e60c21e5cb"
    },
    {
      "path": "schemas/limex-sfh-fuzzi-repo-capsule-receipt-v1.schema.json",
      "sha256": "0cb5ab39ef28cd67601e514a74c3668a36fc0930b54586b65628c3439a1f53b2"
    },
    {
      "path": "scripts/canonical_state_v2.mjs",
      "sha256": "521b6d1bbb2508ae69b4f80aa61c985bf60188badcb44941ae5cb30dab62f30c"
    },
    {
      "path": "scripts/defect_event_projector_v4.mjs",
      "sha256": "d2d34f5dc9867328af0ffcc327161f7349566efacb739f2203d451d45492f0cf"
    },
    {
      "path": "scripts/global_hold_release_adapter_v1.mjs",
      "sha256": "4b91b28fa4443a1a65bc80bf435170802dddb7b19172e9c864de1532d324546a"
    },
    {
      "path": "scripts/strict_json.mjs",
      "sha256": "11620b4ecb4904fa29ba0b280f3ecc40846cb05b28765fb0a38c53af6c7711d1"
    },
    {
      "path": "tests/run_fuzzi_sfh_software_stress_v1.mjs",
      "sha256": "85895016760d339001da797e78e7c87b19324237ba94773778b55565f3e2daed"
    },
    {
      "path": "tests/run_global_hold_release_adapter_v1_adversarial.mjs",
      "sha256": "8a2e1ded1bcee54bd4e41fcf21ac6b24424220dac1578bb5a0dc45ca8a60f183"
    }
  ],
  "self_exclusion": {
    "excluded_from_payload_hashes": [
      "ARTIFACT_MANIFEST.json",
      "RECEIPT_SFH_FUZZI_v1_0.json",
      "SHA256SUMS"
    ],
    "reason": "PREVENT_SELF_REFERENTIAL_HASH_CYCLE"
  },
  "non_implications": [
    "NO_INSTALLATION",
    "NO_RUNTIME_ACTIVATION",
    "NO_PRODUCT_RUNTIME_BINDING_OR_ACTION_AUTHORIZATION",
    "NO_PHYSICAL_RF_EMI_SENSOR_VOLTAGE_OR_HARDWARE_TEST",
    "NO_HARD_REAL_TIME_GUARANTEE",
    "NO_TSA_SECURE_MONOTONIC_OR_HARDWARE_CLOCK_ATTESTATION",
    "NO_SAFETY_CERTIFICATION_OR_LEGAL_CONCLUSION"
  ],
  "next_gate": "PUBLISH_EXACT_TAG_AND_VERIFY_RELEASE_ASSETS"
}
